{
  "version": 1,
  "kind": "template",
  "name": "My first template",
  "page": {
    "width": 672,
    "height": 816,
    "typstWidth": "7in",
    "typstHeight": "8.5in",
    "background": "#fffaf1"
  },
  "elements": [
    {
      "id": "el_mqxak02d_15edyf",
      "type": "grid",
      "name": "Grid Layout",
      "x": 46,
      "y": 27,
      "width": 500,
      "height": 140,
      "margin": 0,
      "padding": 8,
      "style": {
        "font": "Calibri",
        "fontSize": 11,
        "fontWeight": "regular",
        "fontStyle": "normal",
        "color": "#251d18",
        "background": "#FF00FF",
        "borderColor": "#d8cdbd",
        "borderWidth": 1,
        "align": "left"
      },
      "schema": [],
      "data": {
        "rows": 8,
        "columns": 2,
        "cellPadding": 6,
        "cells": [
          "Cell A",
          "Cell 2",
          "Cell 3",
          "Cell 4"
        ],
        "rowGap": "",
        "columnGap": ""
      }
    },
    {
      "id": "el_mqxaoya1_a3ha3k",
      "type": "stack",
      "name": "Stack Layout",
      "x": 78,
      "y": 312,
      "width": 260,
      "height": 160,
      "margin": 0,
      "padding": 8,
      "style": {
        "font": "Calibri",
        "fontSize": 11,
        "fontWeight": "regular",
        "fontStyle": "normal",
        "color": "#251d18",
        "background": "transparent",
        "borderColor": "#d8cdbd",
        "borderWidth": 1,
        "align": "left"
      },
      "schema": [],
      "data": {
        "direction": "vertical",
        "gap": 8,
        "items": [
          "First item",
          "Second item"
        ]
      }
    }
  ]
}
