{
  "version": 1,
  "kind": "template",
  "name": "New Template",
  "page": {
    "width": 672,
    "height": 816,
    "typstWidth": "7in",
    "typstHeight": "8.5in",
    "background": "#ffffff"
  },
  "elements": [
    {
      "id": "el_mqxak02d_15edyf",
      "type": "grid",
      "name": "Grid Layout",
      "width": 500,
      "height": 140,
      "margin": 0,
      "padding": 8,
      "style": {
        "font": "Calibri",
        "fontSize": 11,
        "fontWeight": "regular",
        "fontStyle": "normal",
        "color": "#251d18",
        "background": "#FF00FF",
        "borderColor": "#d8cdbd",
        "borderWidth": 1,
        "align": "left"
      },
      "schema": [],
      "data": {
        "rows": 8,
        "columns": 2,
        "cellPadding": 6,
        "rowGap": "",
        "columnGap": ""
      },
      "children": [
        {
          "id": "el_mr2imd4p_xz2b19",
          "type": "text",
          "name": "Cell 1",
          "width": "100%",
          "height": "auto",
          "margin": 0,
          "padding": 6,
          "style": {
            "font": "Calibri",
            "fontSize": 11,
            "fontWeight": "regular",
            "fontStyle": "normal",
            "color": "#251d18",
            "background": "transparent",
            "borderColor": "#d8cdbd",
            "borderWidth": 0,
            "align": "left"
          },
          "schema": [],
          "data": {
            "text": "Cell A"
          }
        },
        {
          "id": "el_mr2imd4p_pchsop",
          "type": "text",
          "name": "Cell 2",
          "width": "100%",
          "height": "auto",
          "margin": 0,
          "padding": 6,
          "style": {
            "font": "Calibri",
            "fontSize": 11,
            "fontWeight": "regular",
            "fontStyle": "normal",
            "color": "#251d18",
            "background": "transparent",
            "borderColor": "#d8cdbd",
            "borderWidth": 0,
            "align": "left"
          },
          "schema": [],
          "data": {
            "text": "Cell 2"
          }
        },
        {
          "id": "el_mr2imd4p_kds796",
          "type": "text",
          "name": "Cell 3",
          "width": "100%",
          "height": "auto",
          "margin": 0,
          "padding": 6,
          "style": {
            "font": "Calibri",
            "fontSize": 11,
            "fontWeight": "regular",
            "fontStyle": "normal",
            "color": "#251d18",
            "background": "transparent",
            "borderColor": "#d8cdbd",
            "borderWidth": 0,
            "align": "left"
          },
          "schema": [],
          "data": {
            "text": "Cell 3"
          }
        },
        {
          "id": "el_mr2imd4p_h503kd",
          "type": "text",
          "name": "Cell 4",
          "width": "100%",
          "height": "auto",
          "margin": 0,
          "padding": 6,
          "style": {
            "font": "Calibri",
            "fontSize": 11,
            "fontWeight": "regular",
            "fontStyle": "normal",
            "color": "#251d18",
            "background": "transparent",
            "borderColor": "#d8cdbd",
            "borderWidth": 0,
            "align": "left"
          },
          "schema": [],
          "data": {
            "text": "Cell 4"
          }
        }
      ]
    },
    {
      "id": "el_mqxaoya1_a3ha3k",
      "type": "stack",
      "name": "Stack Layout",
      "width": 260,
      "height": 160,
      "margin": 0,
      "padding": 8,
      "style": {
        "font": "Calibri",
        "fontSize": 11,
        "fontWeight": "regular",
        "fontStyle": "normal",
        "color": "#251d18",
        "background": "transparent",
        "borderColor": "#d8cdbd",
        "borderWidth": 1,
        "align": "left"
      },
      "schema": [],
      "data": {
        "direction": "vertical",
        "gap": 8
      },
      "children": [
        {
          "id": "el_mr2imd4p_vqm57l",
          "type": "text",
          "name": "Item 1",
          "width": "100%",
          "height": "auto",
          "margin": 0,
          "padding": 6,
          "style": {
            "font": "Calibri",
            "fontSize": 11,
            "fontWeight": "regular",
            "fontStyle": "normal",
            "color": "#251d18",
            "background": "transparent",
            "borderColor": "#d8cdbd",
            "borderWidth": 0,
            "align": "left"
          },
          "schema": [],
          "data": {
            "text": "First item"
          }
        },
        {
          "id": "el_mr2imd4p_om9l4e",
          "type": "text",
          "name": "Item 2",
          "width": "100%",
          "height": "auto",
          "margin": 0,
          "padding": 6,
          "style": {
            "font": "Calibri",
            "fontSize": 11,
            "fontWeight": "regular",
            "fontStyle": "normal",
            "color": "#251d18",
            "background": "transparent",
            "borderColor": "#d8cdbd",
            "borderWidth": 0,
            "align": "left"
          },
          "schema": [],
          "data": {
            "text": "Second item"
          }
        }
      ]
    }
  ]
}
