{
  "version": 1,
  "kind": "template",
  "name": "Starter Template",
  "page": {
    "width": 672,
    "height": 816,
    "typstWidth": "7in",
    "typstHeight": "8.5in",
    "background": "#fffaf1"
  },
  "elements": [
    {
      "id": "el_mqrm18oz_g6q5tz",
      "type": "text",
      "name": "Season and Date",
      "width": 596,
      "height": 42,
      "margin": 0,
      "padding": 8,
      "style": {
        "font": "Eras Demi ITC",
        "fontSize": 18,
        "fontWeight": "bold",
        "fontStyle": "normal",
        "color": "#251d18",
        "background": "transparent",
        "borderColor": "#d8cdbd",
        "borderWidth": 0,
        "align": "left"
      },
      "schema": [],
      "data": {
        "text": "Second Sunday After Pentecost    June 7, 2026"
      }
    },
    {
      "id": "el_mqrm6jxj_07314u",
      "type": "music",
      "name": "Music",
      "width": 300,
      "height": 120,
      "margin": 0,
      "padding": 8,
      "style": {
        "font": "Calibri",
        "fontSize": 11,
        "fontWeight": "regular",
        "fontStyle": "normal",
        "color": "#251d18",
        "background": "transparent",
        "borderColor": "#d8cdbd",
        "borderWidth": 1,
        "align": "left"
      },
      "schema": [],
      "data": {
        "title": "Music / Lead Sheet",
        "notes": "Import support TBD"
      }
    },
    {
      "id": "el_mqrm6khv_xydu3q",
      "type": "stack",
      "name": "Stack",
      "width": 220,
      "height": 90,
      "margin": 0,
      "padding": 8,
      "style": {
        "font": "Calibri",
        "fontSize": 11,
        "fontWeight": "regular",
        "fontStyle": "normal",
        "color": "#251d18",
        "background": "transparent",
        "borderColor": "#d8cdbd",
        "borderWidth": 1,
        "align": "left"
      },
      "schema": [],
      "data": {
        "direction": "vertical",
        "gap": 8,
        "items": [
          "First item",
          "Second item"
        ]
      }
    },
    {
      "id": "el_mqrm6l2r_1qy4x9",
      "type": "grid",
      "name": "Grid",
      "width": 220,
      "height": 90,
      "margin": 0,
      "padding": 8,
      "style": {
        "font": "Calibri",
        "fontSize": 11,
        "fontWeight": "regular",
        "fontStyle": "normal",
        "color": "#251d18",
        "background": "transparent",
        "borderColor": "#d8cdbd",
        "borderWidth": 1,
        "align": "left"
      },
      "schema": [],
      "data": {
        "rows": 2,
        "columns": 2,
        "cellPadding": 6,
        "cells": [
          "Cell 1",
          "Cell 2",
          "Cell 3",
          "Cell 4"
        ]
      }
    },
    {
      "id": "el_mqrm6lqr_pxj37e",
      "type": "stack",
      "name": "Stack",
      "width": 220,
      "height": 90,
      "margin": 0,
      "padding": 8,
      "style": {
        "font": "Calibri",
        "fontSize": 11,
        "fontWeight": "regular",
        "fontStyle": "normal",
        "color": "#251d18",
        "background": "transparent",
        "borderColor": "#d8cdbd",
        "borderWidth": 1,
        "align": "left"
      },
      "schema": [],
      "data": {
        "direction": "vertical",
        "gap": 8,
        "items": [
          "First item",
          "Second item"
        ]
      }
    },
    {
      "id": "el_mqrm6m77_z8vkds",
      "type": "music",
      "name": "Music",
      "width": 300,
      "height": 120,
      "margin": 0,
      "padding": 8,
      "style": {
        "font": "Calibri",
        "fontSize": 11,
        "fontWeight": "regular",
        "fontStyle": "normal",
        "color": "#251d18",
        "background": "transparent",
        "borderColor": "#d8cdbd",
        "borderWidth": 1,
        "align": "left"
      },
      "schema": [],
      "data": {
        "title": "Music / Lead Sheet",
        "notes": "Import support TBD"
      }
    },
    {
      "id": "el_mqrm6mx7_ybppyi",
      "type": "stack",
      "name": "Stack",
      "width": 220,
      "height": 90,
      "margin": 0,
      "padding": 8,
      "style": {
        "font": "Calibri",
        "fontSize": 11,
        "fontWeight": "regular",
        "fontStyle": "normal",
        "color": "#251d18",
        "background": "transparent",
        "borderColor": "#d8cdbd",
        "borderWidth": 1,
        "align": "left"
      },
      "schema": [],
      "data": {
        "direction": "vertical",
        "gap": 8,
        "items": [
          "First item",
          "Second item"
        ]
      }
    },
    {
      "id": "el_mqrm6ndv_v3f1yk",
      "type": "grid",
      "name": "Grid",
      "width": 220,
      "height": 90,
      "margin": 0,
      "padding": 8,
      "style": {
        "font": "Calibri",
        "fontSize": 11,
        "fontWeight": "regular",
        "fontStyle": "normal",
        "color": "#251d18",
        "background": "transparent",
        "borderColor": "#d8cdbd",
        "borderWidth": 1,
        "align": "left"
      },
      "schema": [],
      "data": {
        "rows": 2,
        "columns": 2,
        "cellPadding": 6,
        "cells": [
          "Cell 1",
          "Cell 2",
          "Cell 3",
          "Cell 4"
        ]
      }
    },
    {
      "id": "el_mqrm6ntf_ali93h",
      "type": "image",
      "name": "Image",
      "width": 180,
      "height": 110,
      "margin": 0,
      "padding": 8,
      "style": {
        "font": "Calibri",
        "fontSize": 11,
        "fontWeight": "regular",
        "fontStyle": "normal",
        "color": "#251d18",
        "background": "transparent",
        "borderColor": "#d8cdbd",
        "borderWidth": 0,
        "align": "left"
      },
      "schema": [],
      "data": {
        "path": "assets/church/ChurchCross.png",
        "fit": "contain"
      }
    },
    {
      "id": "el_mqrm18oz_q5brrn",
      "type": "text",
      "name": "Welcome Text",
      "width": 260,
      "height": 78,
      "margin": 0,
      "padding": 8,
      "style": {
        "font": "Calibri",
        "fontSize": 11,
        "fontWeight": "regular",
        "fontStyle": "normal",
        "color": "#251d18",
        "background": "#ffffff",
        "borderColor": "#d8cdbd",
        "borderWidth": 1,
        "align": "left"
      },
      "schema": [],
      "data": {
        "text": "Add bulletin sections by dragging elements from the palette. Use the inspector for exact placement and styling."
      }
    },
    {
      "id": "el_mqrm18oz_v5my27",
      "type": "image",
      "name": "Series Logo",
      "width": 288,
      "height": 150,
      "margin": 0,
      "padding": 8,
      "style": {
        "font": "Calibri",
        "fontSize": 11,
        "fontWeight": "regular",
        "fontStyle": "normal",
        "color": "#251d18",
        "background": "transparent",
        "borderColor": "#d8cdbd",
        "borderWidth": 0,
        "align": "left"
      },
      "schema": [],
      "data": {
        "path": "assets/sermon_series/say_it_out_loud/logo.png",
        "fit": "contain"
      }
    },
    {
      "id": "el_mqrm6od0_21dc3c",
      "type": "text",
      "name": "Text",
      "width": 220,
      "height": 90,
      "margin": 0,
      "padding": 8,
      "style": {
        "font": "Calibri",
        "fontSize": 11,
        "fontWeight": "regular",
        "fontStyle": "normal",
        "color": "#251d18",
        "background": "#ffffff",
        "borderColor": "#d8cdbd",
        "borderWidth": 1,
        "align": "left"
      },
      "schema": [],
      "data": {
        "text": "Text element"
      }
    },
    {
      "id": "el_mqrm18oz_klmo3b",
      "type": "text",
      "name": "Theme",
      "width": 500,
      "height": 68,
      "margin": 0,
      "padding": 8,
      "style": {
        "font": "Eras Demi ITC",
        "fontSize": 24,
        "fontWeight": "bold",
        "fontStyle": "normal",
        "color": "#251d18",
        "background": "transparent",
        "borderColor": "#d8cdbd",
        "borderWidth": 0,
        "align": "center"
      },
      "schema": [],
      "data": {
        "text": "GOD LOVES SINNERS*"
      }
    },
    {
      "id": "el_mqrm18oz_nd9mho",
      "type": "image",
      "name": "Church Logo",
      "width": 216,
      "height": 82,
      "margin": 0,
      "padding": 8,
      "style": {
        "font": "Calibri",
        "fontSize": 11,
        "fontWeight": "regular",
        "fontStyle": "normal",
        "color": "#251d18",
        "background": "transparent",
        "borderColor": "#d8cdbd",
        "borderWidth": 0,
        "align": "left"
      },
      "schema": [],
      "data": {
        "path": "assets/church/logo.png",
        "fit": "contain"
      }
    }
  ]
}
